Assuming unrestricted shared filesystem usage.
None
host: stallion.srvint.efrei.fr
Building DAG of jobs...
Your conda installation is not configured to use strict channel priorities. This is however important for having robust and correct environments (for details, see https://conda-forge.org/docs/user/tipsandtricks.html). Please consider to configure strict priorities by executing 'conda config --set channel_priority strict'.
Using shell: /usr/bin/bash
Provided cores: 16
Rules claiming more threads will be scaled down.
Job stats:
job                  count
-----------------  -------
all                      1
plot_ARGs_all            1
plot_ARGs_by_gene        3
total                    5

Select jobs to execute...
Execute 4 jobs...
[Sun Jul 27 15:42:43 2025]
localrule plot_ARGs_by_gene:
    input: results/barcode05/abricate/barcode05_ARG_summary.tsv
    output: results/barcode05/plots/barcode05_ARGs_by_gene.png
    jobid: 13
    reason: Missing output files: results/barcode05/plots/barcode05_ARGs_by_gene.png; Code has changed since last execution
    wildcards: sample=barcode05
    resources: tmpdir=/tmp
Activating conda environment: .snakemake/conda/f550386a40310a0327be21f8ca3f63dd_
[Sun Jul 27 15:42:43 2025]
localrule plot_ARGs_by_gene:
    input: results/barcode06/abricate/barcode06_ARG_summary.tsv
    output: results/barcode06/plots/barcode06_ARGs_by_gene.png
    jobid: 14
    reason: Missing output files: results/barcode06/plots/barcode06_ARGs_by_gene.png; Code has changed since last execution
    wildcards: sample=barcode06
    resources: tmpdir=/tmp
Activating conda environment: .snakemake/conda/f550386a40310a0327be21f8ca3f63dd_
[Sun Jul 27 15:42:43 2025]
localrule plot_ARGs_by_gene:
    input: results/barcode07/abricate/barcode07_ARG_summary.tsv
    output: results/barcode07/plots/barcode07_ARGs_by_gene.png
    jobid: 15
    reason: Missing output files: results/barcode07/plots/barcode07_ARGs_by_gene.png; Code has changed since last execution
    wildcards: sample=barcode07
    resources: tmpdir=/tmp
Activating conda environment: .snakemake/conda/f550386a40310a0327be21f8ca3f63dd_
[Sun Jul 27 15:42:43 2025]
localrule plot_ARGs_all:
    input: results/barcode05/abricate/barcode05_ARG_summary.tsv, results/barcode06/abricate/barcode06_ARG_summary.tsv, results/barcode07/abricate/barcode07_ARG_summary.tsv
    output: results/summary/all_ARGs.png
    jobid: 16
    reason: Missing output files: results/summary/all_ARGs.png
    resources: tmpdir=/tmp
Activating conda environment: .snakemake/conda/f550386a40310a0327be21f8ca3f63dd_
RuleException:
CalledProcessError in file "/data/armel/git/MetagenAMR-main/workflow/rules/plot_ARGs_all.smk", line 9:
Command 'source /home/armel/miniforge3/envs/snakemake-env/bin/activate '/data/armel/git/MetagenAMR-main/.snakemake/conda/f550386a40310a0327be21f8ca3f63dd_'; set -euo pipefail;  
        mkdir -p results/summary
        python /data/armel/git/MetagenAMR-main/workflow/scripts/plot_ARGs_all.py results/summary/all_ARGs.png results/barcode05/abricate/barcode05_ARG_summary.tsv results/barcode06/abricate/barcode06_ARG_summary.tsv results/barcode07/abricate/barcode07_ARG_summary.tsv' returned non-zero exit status 1.
[Sun Jul 27 15:42:45 2025]
Error in rule plot_ARGs_all:
    message: None
    jobid: 16
    input: results/barcode05/abricate/barcode05_ARG_summary.tsv, results/barcode06/abricate/barcode06_ARG_summary.tsv, results/barcode07/abricate/barcode07_ARG_summary.tsv
    output: results/summary/all_ARGs.png
    conda-env: /data/armel/git/MetagenAMR-main/.snakemake/conda/f550386a40310a0327be21f8ca3f63dd_
    shell:
        
        mkdir -p results/summary
        python /data/armel/git/MetagenAMR-main/workflow/scripts/plot_ARGs_all.py results/summary/all_ARGs.png results/barcode05/abricate/barcode05_ARG_summary.tsv results/barcode06/abricate/barcode06_ARG_summary.tsv results/barcode07/abricate/barcode07_ARG_summary.tsv
        
        (command exited with non-zero exit code)
[Sun Jul 27 15:42:47 2025]
Finished jobid: 15 (Rule: plot_ARGs_by_gene)
1 of 5 steps (20%) done
[Sun Jul 27 15:42:47 2025]
Finished jobid: 13 (Rule: plot_ARGs_by_gene)
2 of 5 steps (40%) done
[Sun Jul 27 15:42:47 2025]
Finished jobid: 14 (Rule: plot_ARGs_by_gene)
3 of 5 steps (60%) done
Shutting down, this might take some time.
Exiting because a job execution failed. Look below for error messages
[Sun Jul 27 15:42:47 2025]
Error in rule plot_ARGs_all:
    message: None
    jobid: 16
    input: results/barcode05/abricate/barcode05_ARG_summary.tsv, results/barcode06/abricate/barcode06_ARG_summary.tsv, results/barcode07/abricate/barcode07_ARG_summary.tsv
    output: results/summary/all_ARGs.png
    conda-env: /data/armel/git/MetagenAMR-main/.snakemake/conda/f550386a40310a0327be21f8ca3f63dd_
    shell:
        
        mkdir -p results/summary
        python /data/armel/git/MetagenAMR-main/workflow/scripts/plot_ARGs_all.py results/summary/all_ARGs.png results/barcode05/abricate/barcode05_ARG_summary.tsv results/barcode06/abricate/barcode06_ARG_summary.tsv results/barcode07/abricate/barcode07_ARG_summary.tsv
        
        (command exited with non-zero exit code)
Complete log(s): /data/armel/git/MetagenAMR-main/.snakemake/log/2025-07-27T154241.804048.snakemake.log
WorkflowError:
At least one job did not complete successfully.
